{
  "id": "med-895d3705",
  "domain": "medical",
  "source_file": "Autism_CDC.pdf",
  "title": "كيف تتعامل مع القلق حول طفلك الصغير؟",
  "language": "ar",
  "age_group": "prenatal-1",
  "behavior_type": "قلق",
  "intervention_type": "إرشادي",
  "severity": "متوسط",
  "reference_type": "تقرير_طبي",
  "reference_info": "CDC — Learn the Signs. Act Early: قوائم مراحل النمو (Milestone Checklists)",
  "text_original": "does not do that concerns you? • Has your baby lost any skills he/she once had? • Does your baby have any special healthcare needs or was he/she born prematurely? You know your baby best. Don’t wait. If your baby is not meeting one or more milestones, has lost skills he or she once had, or you have other concerns, act early. Talk with your baby’s doctor, share your concerns, and ask about developmental screening. If you or the doctor are still concerned: 1. Ask for a referral to a specialist who can evaluate your baby more; and 2. Call your state or territory’s early intervention program to find out if your baby can get services to help. Learn more and find the number at cdc.gov/FindEI. For more on how to help your baby, visit cdc.gov/Concerned. Acting early can make a real difference! Help your baby learn and grow As your baby’s first teacher, you can help his or her learning and brain development. Try these simple tips and activities in a safe way. Talk with your baby’s doctor and teachers if you have questions or for more ideas on how to help your baby’s development. • Respond positively to your baby. Act excited, smile, and talk to him when he makes sounds. This teaches him to take turns “talking” back and forth in conversation. • Talk, read, and sing to your baby to help her develop and understand language. • Spend time cuddling and holding your baby. This will",
  "text_simplified": "إذا كان لديك أي قلق حول طفلك، ابدأ بالتحدث مع الطبيب إذا فقد طفلك مهارات كانت لديه من قبل أو إذا كان يحتاج إلى الرعاية الصحية الخاصة. تواصل مع الأطباء واسأل عن الاختبارات التنموية.",
  "labels": [
    "قلق",
    "طفل صغير",
    "رعاية صحية"
  ],
  "created_at": "2026-06-07T08:12:49Z",
  "updated_at": "2026-07-27",
  "version": "1.0.0",
  "source_meta": {
    "source_title": "Autism_CDC",
    "source_author": ""
  }
}