{
  "id": "df2bbc86-7340-4b26-9b96-0d3295c9a1b6",
  "domain": "development",
  "age_group": "13-15",
  "behavior_type": "المراهقة_والتطور_العصبي",
  "intervention_type": "إرشادي",
  "severity": "متوسط",
  "reference_type": "مقال_تنموي",
  "reference_info": "The Adolescent Brain — UNICEF Guatemala",
  "text_original": "is pivotal period of development. These advances  in knowledge have leapt from laboratories and academic journals, and can now be  found in mainstream newspapers and magazines. Countless books have appeared  on the topic, explaining why adolescents behave the way they do – some of them  bestsellers. The wide interest is prompting a global community of researchers,  practitioners, scientists, service deliverers and parents to ask the question: How can  we use this information to enhance policy and programme responses that improve  outcomes for adolescents?  The commentaries in this compendium t",
  "text_simplified": "من The Adolescent Brain — UNICEF Guatemala: is pivotal period of development. These advances  in knowledge have leapt from laboratories and academic journals, and can now be  found in mainstream newspapers and magazines. Countless books have appeared  on the topic, explaining why adolescents b...",
  "labels": [
    "unicef",
    "adolescent_brain",
    "english"
  ],
  "created_at": "2026-06-06T14:35:15.742607Z",
  "updated_at": "2026-06-06T14:35:15.742607Z",
  "version": "1.0.0"
}