{
  "id": "ae449033-324c-46ec-ba6d-43617e53baa1",
  "domain": "development",
  "age_group": "13-15",
  "behavior_type": "المراهقة_والتطور_العصبي",
  "intervention_type": "إرشادي",
  "severity": "متوسط",
  "reference_type": "مقال_تنموي",
  "reference_info": "The Adolescent Brain — UNICEF Guatemala",
  "text_original": "UNICEF Office of Research - Innocenti,  Florence. © 2017 United Nations Children’s Fund (UNICEF) UNICEF Office of Research – Innocenti Piazza SS. Annunziata, 12 50122 Florence, Italy Tel: (+39) 055 20 330 Fax: (+39) 055 2033 220 florence@unicef.org www.unicef-irc.org ISBN: 978 88 6522 048 1 Front cover: © Todd Siler Below the Clouds of Consciousness, 1989  Courtesy Ronald Feldman Fine Arts, New York  ACKNOWLEDGEMENTS This compendium was edited by Nikola Balvin (Knowledge Management Specialist,  Innocenti) and Prerna Banati (Chief, Programme and Planning, Innocenti). Production was overseen by",
  "text_simplified": "من The Adolescent Brain — UNICEF Guatemala: UNICEF Office of Research - Innocenti,  Florence. © 2017 United Nations Children’s Fund (UNICEF) UNICEF Office of Research – Innocenti Piazza SS. Annunziata, 12 50122 Florence, Italy Tel: (+39) 055 20 330 Fax: (+39) 055 2033 220 florence@unicef.org w...",
  "labels": [
    "unicef",
    "adolescent_brain",
    "english"
  ],
  "created_at": "2026-06-06T14:35:15.742607Z",
  "updated_at": "2026-06-10T20:00:00Z",
  "version": "1.0.0",
  "title": "تعريف بتقرير دماغ المراهق — مكتب أبحاث اليونيسف"
}
