{
  "id": "isl-72259d18",
  "domain": "islamic_parenting",
  "age_group": "unspecified",
  "behavior_type": "حوار",
  "intervention_type": "إرشادي",
  "severity": "خفيف",
  "reference_type": "كتاب_تربوي",
  "reference_info": "تربية الأولاد في الإسلام - علوان",
  "text_original": "الفاضل الذي كان حلم المفكرين » وأمنية الفلاسفة منذ القدم .. وكيف لا 4 والقاضي يجلس بيايم سنتين ولا يتخاصم. إليه اثنان 9 ولاذا يتخاصموذ وبين أيديهم القران ؟ وماذا يختلفون وهم يحبون لاخواتهم مايحبون لأنفسهم ؟ وللاذا يتباغضون والإسلام يأمرهم بامحبة والإخاء » ويحضهم على التعاطف و«الإيثار؟ وإليكم ماقاله الصحالي الجليل ( عبدالله بن مسعود ) رضي الله عنه في تغداد محامدهم وفضائلهم ‎٠‏ ووجوب التأبي بأفعالهم الحميدة ‎٠‏ وأخلاقهم الكرعة .. ( من كان متأسيا فليتأسَ بأصحاب رسول الله يهم فاه مهم كانوا أبر هذه الأمة قلا ؛ وأعمقها علماً » وأقلها تكلفاً ‎٠‏ وأقومها هديا ؛ وأحسنبا حالاء اخترهم ال لصحبة نبيه مله » وإقامة دينه » فاعرفوا هم فضلهم:. واتبعوهم في اثارهم » فإنهم كانوا على الحدى المستقم ) . - وظلت الأجيال المسلمة عبر القرون تستقي'من معين فضائلهم . وتستضيء بنور مكارمهم » وتنبج في التربية مجهم » وتسير في بناء المجد سيرهم ... حتى العصر الذي انمسر فيه عن الجتمع ‏ الإسلامى حكم الإسلام ‎٠‏ وزالت في الأرض معالم المخلافة الإسلامية .. واستطاع أعداء الإسلام أن يصلوا إلى هدفهم الخبيث وغرضهم الدفين في تحويل العالم الإسلامي إلى أم متناحرة ‎٠‏ ودول متتخاصمة متنايزة .. تتقاذفهم الأهواء . وتجتذبهم المطامع » وتفرقهم المبادىء . وينساقون وراء الشهوات والملذات ‎٠‏ ويتخبطون في أوحال التحلل والإباخية ... ويسيرون بلا هدف ولا غاية » ويعيشون من غير ماسعي إلى مد ولا وحدة ولا كيان ... تحسبهم جميعاً وقلوبهم شتى . وتظنهم قوة ولكنهم غثاء كغثاء السيل ؛ حتى إن كثيراً من رجالات الإصلاح ‎٠‏ وأرباب الدعوة إلى الله",
  "text_simplified": "الحوار بين القاضي والمحامدين يدل على أهمية الإخاء والتآخي في الإسلام. كما أوصى الصحابة الرضي عنهم بالتأمل في أعمال وأخلاق أصحاب النبي محمد صلى الله عليه وسلم.",
  "labels": [
    "الإسلام",
    "الأخوة",
    "التربية"
  ],
  "created_at": "2026-06-07T03:24:00Z",
  "updated_at": "2026-06-10T20:30:00Z",
  "version": "1.0.0",
  "source_meta": {
    "source_title": "تربية الأولاد في الإسلام",
    "source_author": "عبد الله ناصح علوان"
  },
  "title": "الإخاء والتآخي: دروس من حوارات السلف"
}
