{
  "id": "isl-5a55d030",
  "domain": "islamic_parenting",
  "source_file": "Alukah_Rights_of_Children.pdf",
  "title": "حوار غير واضح يحتاج توضيح",
  "language": "ar",
  "age_group": "unspecified",
  "behavior_type": "غير محدد",
  "intervention_type": "إرشادي",
  "severity": "خفيف",
  "reference_type": "كتاب_تربوي",
  "reference_info": "حقوق الأولاد على الوالدين - عماد عبدالعظيم (الألوكة)",
  "text_original": "اَٚ دَ بْ طَ ايَ : ةَ عَ ق ِ بر ـِ بْ للها دبْ عَ ل دقَ ر فَ ـُ بْ ةُ بَ تْ طُ لَ اقَ : لَ اقَ ,ةَ عَ ق ِ بر ـِ بْ للها دبْ طَ ـْ طَ ِ ِ ِ ِ ِ ِ ِ ِ كؾَ طَ لـُـقعيُ : لَ اقَ ,؟ كَ اذَ ام وَ :لَ اقَ ,؟ؽقخأَ ـِ بْ ا كؾَ طَ لـُـقعتُ َٓ أَ , للها قَ هُ وَ دضَ عَ م كلَِ إ ر ظَ َـفَ : لَ اقَ ,كابَ أَ عْ صأَ ,ور طَ ايَ :للها دُ بْ طَ فُ لَ لَ اؼَ فَ ,ؾٍ ؿ ل ِ ك ِ إ , ت ِ بَ أَ ايَ :ور طَ لَ اؼَ فَ :لَ اقَ ﴾ َ ﴿ ؿ فُ عْ ِ طتُ َٓ : لَ اؼَ فَ ,سٌ ِ لاجَ ؽبُ حُٕ لكِ إ لَـ بُ ايَ : لَ اقَ وَ ,ةُ بَ تْ طُ كؽَ بَ فَ :لَ اقَ ,لتبَ قَ ر كاؽَ ف ل ف ؾُ ؿ طْ أَ دٌ بْ طَ اكَ أَ اؿ لـتقْ تَ أَ تْـكُ ؽكَ إ , تبَ أَ ايَ :ور طَ :لَ اؼَ فَ :لَ اقَ ,هُ دَ لَ وَ دلاقَ لْا بَ حُ وَ ف ؾَ ل ابً حُ : ـِ قْ بَ حُ ل َ فَ ل ِ ـطْ دَ فَ َٓ ِ إوَ ,هُ ذْ خُ فَ اذَ قَ فُ فَ فُ ْـطَ ل ِ ؾ ِ ئاس تْـكُ نْ ِ نفَ ,اػً لْأَ ـَ قع ِ بْ",
  "text_simplified": "النص يحتوي على حوار غير مفهوم بسبب تشويش كبير في الحروف والكلمات. لا يمكن استخلاص معنى واضح أو سلوك محدد منه. يُنصح بالتواصل مع مختص لتوضيح المشكلة.",
  "labels": [
    "تشويش",
    "حوار غير مفهوم",
    "تواصل",
    "استشارة"
  ],
  "created_at": "2026-06-21T10:19:44Z",
  "updated_at": "2026-06-21T10:19:44Z",
  "version": "1.0.0",
  "source_meta": {
    "source_title": "Alukah_Rights_of_Children",
    "source_author": ""
  }
}