{
  "id": "70ef8432-d97f-490a-acab-8df9e57f8652",
  "domain": "medical",
  "age_group": "prenatal-1",
  "behavior_type": "التوحد",
  "intervention_type": "إرشادي",
  "severity": "متوسط",
  "reference_type": "DSM-5",
  "reference_info": "Developmental Milestones — CDC Act Early 2025",
  "text_original": "Your baby at 2 months \nBaby’s Name \nBaby’s Age \nToday’s Date \nWhat most babies do by this age: \nSocial/Emotional Milestones \n◦ Calms down when spoken to or picked up \n◦ Looks at your face \n◦ Seems happy to see you when you walk up to her \n◦ Smiles when you talk to or smile at her \nLanguage/Communication Milestones \n◦ Makes sounds other than crying \n◦ Reacts to loud sounds \nCognitive Milestones  \n(learning, thinking, problem-solving) \n◦ Watches you as you move \n◦ Looks at a toy for several seconds \nMovement/Physical Development  \nMilestones \n◦ Holds head up when on tummy \n◦ Moves both arms and",
  "text_simplified": "من Developmental Milestones — CDC Act Early 2025: Your baby at 2 months  Baby’s Name  Baby’s Age  Today’s Date  What most babies do by this age:  Social/Emotional Milestones  ◦ Calms down when spoken to or picked up  ◦ Looks at your face  ◦ Seems hap...",
  "labels": [
    "cdc",
    "autism",
    "milestones",
    "english"
  ],
  "created_at": "2026-06-06T13:23:34.652306Z",
  "updated_at": "2026-06-10T19:30:00Z",
  "version": "1.0.0",
  "title": "مؤشرات نمو طفلك في عمر الشهرين (CDC)"
}