{
  "id": "c59870c1-0083-4c48-84d8-60da0b6cf1b0",
  "domain": "islamic_parenting",
  "age_group": "unspecified",
  "behavior_type": "المنهج_النبوي_في_التربية",
  "intervention_type": "وقائي",
  "severity": "خفيف",
  "reference_type": "كتاب_فقهي",
  "reference_info": "المنهج النبوي في تربية الأولاد — الشيخ عدنان باحارث",
  "text_original": "ولعل هذا الحديث في نظري ‎amos‏ رسالة قوية إلى أولئك الذين يضربون الأطفال من أولياء الأمور\nويخرجونهم من المساجد بحجة أنهم يشغلونهم في صلاتهم. بينما نجد رسول الله صلى الله عليه ‎alg‏ وهو ‎alr‏ المسلمين في صلاتهم يآتي بالأطفال ويضعهم\nمعه في صلاته حتى ينشأون على حب ذلك الركن العظيم الذي هو أهم أركان الدين الإسلامي\nوبصلاحه تصلح شؤون المسلم كلها. أيضا من الجوانب التربيوة في ‎Lo ale‏ الله عليه ‎plug‏ والتي إهتمت وعنت عناية كبرى بالطفل\nما ‎ye) ole‏ ابن عمر: ( أن ‎alll ho Gall‏ عليه وسلم رأى صبيا قد حلق بعض رأسه [ شعره ]\nوترك ‎ade)‏ فنهاهم عن ذلك فقال إحلقوه كله أو أتركوه كله ) )\".",
  "text_simplified": "من المنهج النبوي في التربية: كان النبي ﷺ يصلي وهو حاملٌ أُمامةَ بنتَ ابنته زينب، فإذا سجد وضعها وإذا قام حملها (صحيح البخاري ٥١٦). ويرى المؤلف أن في هذا الهدي رسالةً قوية إلى من يضربون الأطفال أو يُخرجونهم من المساجد بحجة أنهم يشغلونهم في صلاتهم؛ فالطفل الذي يُقرَّب من المسجد برفق ينشأ على حب الصلاة وتعظيمها.",
  "labels": [
    "arabic",
    "islamic_parenting",
    "al_minhaj"
  ],
  "created_at": "2026-06-06T18:14:47.748240Z",
  "updated_at": "2026-06-10T20:30:00Z",
  "version": "1.0.0",
  "title": "حمل النبي ﷺ أمامة في صلاته — الأطفال والمسجد"
}
