{
  "id": "seed-picky-79",
  "domain": "development",
  "source_file": "curated/NHS - Fussy eaters / AAP",
  "title": "الأكل الانتقائي لدى الطفل في عمر سبعة إلى تسعة",
  "language": "ar",
  "age_group": "7-9",
  "behavior_type": "رفض الطعام",
  "intervention_type": "إرشادي",
  "severity": "خفيف",
  "reference_type": "مقال_تنموي",
  "reference_info": "NHS - Fussy eaters / AAP",
  "text_original": "في هذا العمر يمكن إشراك الطفل بشكل أكبر في التخطيط للوجبات واختيار وصفة صحية أسبوعياً. اشرح له فائدة الخضار بلغة بسيطة تربطها بما يحب كالطاقة للعب والقوة. اعتمد قاعدة واضحة وثابتة: نفس طعام العائلة، وله حرية اختيار الكمية، دون طبخ وجبة بديلة خاصة. ضع حدوداً لطيفة على الوجبات الخفيفة قبل الطعام حتى يأتي للمائدة جائعاً. تجنّب وصف الطفل بأنه «صعب الإرضاء» أمامه فالوصف يثبّت السلوك. استمر بتقديم الخضار بهدوء فالقبول يأتي بالتكرار لا بالإجبار.",
  "text_simplified": "في هذا العمر يمكن إشراك الطفل بشكل أكبر في التخطيط للوجبات واختيار وصفة صحية أسبوعياً. اشرح له فائدة الخضار بلغة بسيطة تربطها بما يحب كالطاقة للعب والقوة. اعتمد قاعدة واضحة وثابتة: نفس طعام العائلة، وله حرية اختيار الكمية، دون طبخ وجبة بديلة خاصة. ضع حدوداً لطيفة على الوجبات الخفيفة قبل الطعام حتى يأتي للمائدة جائعاً. تجنّب وصف الطفل بأنه «صعب الإرضاء» أمامه فالوصف يثبّت السلوك. استمر بتقديم الخضار بهدوء فالقبول يأتي بالتكرار لا بالإجبار.",
  "labels": [
    "الأكل الانتقائي",
    "رفض الطعام",
    "التغذية",
    "العادات الصحية",
    "7-9 سنوات"
  ],
  "created_at": "2026-06-13T00:00:00Z",
  "updated_at": "2026-06-13T00:00:00Z",
  "version": "1.0.0",
  "source_meta": {
    "source_title": "NHS - Fussy eaters / AAP",
    "source_author": ""
  }
}