{
  "id": "isl-5b8d2dc3__en",
  "domain": "islamic_parenting",
  "source_file": "Alukah_Rights_of_Children.pdf",
  "title": "Teaching Salah to Children with Rifq and the Example of the Parents",
  "language": "en",
  "age_group": "7-9",
  "behavior_type": "تربية دينية",
  "intervention_type": "إرشادي",
  "severity": "خفيف",
  "reference_type": "كتاب_تربوي",
  "reference_info": "حقوق الأولاد على الوالدين - عماد عبدالعظيم (الألوكة)",
  "text_original": "ـمس مػثمي .ؿهمػمهو ،)4221( لئاسمٜمًاو ،)3165( فمضامُ ـمساو ،)7/5( دحمأ فمضرمظأ (2) ـــــــــــــــتــــــــ نيدلاىلا ىلع دلاولأا قىقح ـــــــــــــــــــــــــــــــــــــــــــــــــــــــــــــــــــــــــــــــــــ ,ڤ ةَ شَ ئاطَ ـْ طَ )1(ـسح داـسنب )41( »لاقعلا« في اقكدلا لبأ ـبا جرخأو حَ لْا ـِ طَ ﷺ للها لُ قس ؼَ طَ : تْ لَاقَ .عباسلا ـط فتقؿست رخمي ٓو ,عباسلا كلإ رقخلتلا زاقج اؿفقف في ثيداحٕا ـم حصأ دلقي ـقح دقلقؿلا ةقؿست في ثيداحٕا تكاك نإو .لؼفقبلا لاق اؿك عباسلا مقي فتقؿست :ديٜٛ ٕأ ٌبق دٛيٛلما ١ُٝطت شٛيجٚ و ُ ۡ تؼ َ ٌَِ ۥلَ ُ ذ وػ َ نَ ۡ َ ً ۡ َ ل يَٰ َ ۡ ي َ ۥّ ُ ٍ ُ ش ۡ ٱ مٍ ٰ ل َ ؾ ُ ِة ك َ شّ ُ ِ ّ َ ب ُ ُ ا ذ ُِإ ٓ اي ذ رك َ ز َ ٰ ي َ ﴿ :كلاعت فلقؼل .)7:ؿيرم ةرقس( ﴾ ّٗ َ .دلقي نأ ؾبق »دؿحأ« ب ﷺ فقبك كلاعت للها كؿسو ۥ ٓ ّ ُ ٍ ُ ش ۡ ٱ يدِ ػ ۡ ب َ َۢ ٌِ تِِ أ َ ي ل ٔش ُ ر َ ِة ا ۢ شّ َ ِ ّ َ بٌ ُ و َ ﴿ :ﷺ كسقط ناسل كؾط كلاعت لاق .)6:ػصلا ةرقس( ﴾ُ َ ۡ ىرأ امُ ،قدمّمًا فمٚمحو ،ثيدلحا برمٓمْمُ :ؿمشامط قمسأ لامى لمُوزخمعا نمامٞمٚمؾ ـمس مامِه لالح (1) بيأ دمٜمق مامي لمٕموامٞمًا ورمٛمق ـمس دمٛمح ـمُ عمسقمش دمىو ،ؿمٚسمُ لامضر ـمُ قهو :تمٚمى ،امؾم٠مس فثيدحمس ىقمؾ فمٜمق يري لم )299/9( »ىمؼمٙمًا ـمٜسمًا« مذ لم٘مٝمٞبمًاو ،)99( »ةمٚمٚمٕمعا",
  "text_simplified": "Parents must teach their children salah and accustom them to it from a young age, while observing rifq (gentleness) and kindness in guidance. The parents should also be a good example for their children in performing acts of worship. Teaching salah strengthens religious values and discipline in the child.",
  "labels": [
    "صلاة",
    "تربية",
    "قدوة",
    "تعليم ديني",
    "أطفال"
  ],
  "created_at": "2026-06-21T10:17:11Z",
  "updated_at": "2026-06-21T10:17:11Z",
  "version": "1.0.0",
  "source_meta": {
    "source_title": "Alukah_Rights_of_Children",
    "source_author": ""
  },
  "source_language": "ar",
  "translated_from": "isl-5b8d2dc3",
  "translation": {
    "translator_model": "mistral-large-3:675b",
    "reviewer_model": "deepseek-v4-pro+glm-5.2",
    "needs_scholar_review": true,
    "review_verdict": "low_only",
    "review_defects": [
      {
        "model": "glm-5.2",
        "field": "title",
        "type": "addition",
        "why": "The Arabic says simply 'the example (القدوة)' without specifying 'of the Parents'; the English adds that specification."
      }
    ],
    "approved_by": "auto-review:deepseek-v4-pro+glm-5.2:2026-10-04",
    "auto_review": {
      "reviewers": [
        "deepseek-v4-pro",
        "glm-5.2"
      ],
      "fixer": null,
      "rounds": 1,
      "prompt_version": "dfa8a5f39718",
      "content_sha256": "f1c003ecc972d905c661c98679606d1f95c01441d6a18f0705c629036a60ade3",
      "reviewed_at": "2026-10-04T11:18:18+00:00",
      "residual_low": [
        {
          "model": "glm-5.2",
          "field": "title",
          "type": "addition",
          "why": "The Arabic says simply 'the example (القدوة)' without specifying 'of the Parents'; the English adds that specification."
        }
      ],
      "adjudicated": [],
      "tool": "ops/tools/review_en_parity.py",
      "meaning": "deterministic guards passed and two different-family model reviewers found no medium/high defect in this exact text; not a scholar's ijazah"
    },
    "revalidated_at": "2026-10-04T11:18:18+00:00"
  }
}
