{
  "id": "isl-707601b0",
  "domain": "islamic_parenting",
  "source_file": "Alukah_Rights_of_Children.pdf",
  "title": "فضل تعليم القرآن للأطفال",
  "language": "ar",
  "age_group": "unspecified",
  "behavior_type": "تعليم ديني",
  "intervention_type": "إرشادي",
  "severity": "خفيف",
  "reference_type": "كتاب_تربوي",
  "reference_info": "حقوق الأولاد على الوالدين - عماد عبدالعظيم (الألوكة)",
  "text_original": ":لاق ,ﭬ ناؿثط ـط )5427( يراخبلا جرخأو )1( تُ أْ ر َ قَ دْ قَ وَ ـَ قـس ر ِ شْ طَ ـُ بْ ا اكَ أَ وَ ﷺ للها لُ قس ُ ر َ لفِ قُ تُ : سٍ ابَ طَ ـُ بْ ا لَ اقَ وَ .نآرؼلا ناقبصلا ؿقؾعت باب :نيٝعيا ٜٔديا زدب ٍاق كلإ ؽلذب راشأ فكلكو نآرؼلا ناقبصلا ؿقؾعت زاقج ناقب في باب اذه يأ« .)3(»ؽلذ هرك ـم كؾط درلا :لاق ,ﭭ سابط ـبا ـط حقحص داـسنب )342/2( ؿكاحلا جرخأو .»رقغص اكأو نآرؼلا تأرق نينف ءاسـلا ةرقس ـط نيقؾس نآرؼلا تأرق نينف ,ػسقي ةرقسو ةرؼبلا ةرقس ـط نيقؾس :سابط ـبا لاق ةاموو ممإ ٓ نآرم٘مًا ظمٗمط ممإ امٕمضار ملمٜمؾ منمق ـمسا امٟأو فمًقمى نقمٙي نأ ؾمٛتيح ؽمًذمً تمٔمٗمط (1) .ةمٜمؾ ةمنمق ثلامص اهدمٜمق فمً نامي فمٟم٢مو ﷺ لبمٜمًا .)5135( يراخبمًا فمضرمظأ (2) .)39/29( »يرام٘مًا ةدمٛمق« (3) دبمق لالح ـسمط دامٜمؾم٢مس )73( »تام٘بمٓمًا باتمي ـمُ كم٘تمٜمعا« مذ نيارلحا ةمسورمق قمسأ امٝمضرمظأ (4) قمسأ لامىو ،ذمظٕا ـسمط ،ةمٜمٞمٞمق ـمسا دمٜمق فتيأر :ؾبمٜمط ـمس دحمأ لامى ،رامٓمٕمًا ءلامٕمًا ـمس رابلجا = ٓ :رمظآ عضقمُ مذ لامىو ،ةم٘مص :لئاسمٜمًا لامىو ،خمٞمؿ :رمظآ عضقمُ مذ لامىو ،حمًاص :ؿمشامط ــــــــــــــــــــــــــــــــــــــــــــــــــــــــــــــــــــــــــــــــــــ نيدلاىلا ىلع دلاولأا قىقح ــــــــــــــــــــ كلإ اودفو فمقق ـم ارػكو هابأ نأ ,لمرجلا سقق ـب ةؿؾس ـب ورؿط ـطو ـم :فل اقلاؼف ,ؿفجئاقح اقضقو ,نآرؼلا اقؿؾعتو ,ساـلا ؿؾسأ ـقح ﷺ لبـلا اوؤاجف :لاق ,نآرؼؾل اذخأ وأ ,اعؿج ؿكرثكأ ؿؽب ؾصقل :لاؼف ,اـل وأ اـب لؾصي نآرؼلا ـم عؿج وأ اذخأ رثكأ ادحأ ؿفقف اودجي ؿؾف ؿفقف اقللسف ؿفمقق كلإ .)1(»ملاغ ذئمقي اكأو",
  "text_simplified": "هذا النص يتناول فضل قراءة القرآن الكريم وأهمية تعليمه للأطفال. يشير إلى أن من يعلم أطفاله القرآن ويقرؤونه ينالون أجرًا عظيمًا. كما يذكر أن الأطفال الذين يقرؤون القرآن يكونون في شفاعة لوالديهم يوم القيامة.",
  "labels": [
    "قرآن",
    "تعليم أطفال",
    "تربية دينية",
    "فضل القراءة"
  ],
  "created_at": "2026-06-21T10:22:33Z",
  "updated_at": "2026-06-21T10:22:33Z",
  "version": "1.0.0",
  "source_meta": {
    "source_title": "Alukah_Rights_of_Children",
    "source_author": ""
  }
}