{
  "id": "isl-ae3d3405__en",
  "domain": "islamic_parenting",
  "source_file": "Alukah_Rights_of_Children.pdf",
  "title": "Text Not Suitable for Analysis",
  "language": "en",
  "age_group": "unspecified",
  "behavior_type": "غير محدد",
  "intervention_type": "وقائي",
  "severity": "خفيف",
  "reference_type": "كتاب_تربوي",
  "reference_info": "حقوق الأولاد على الوالدين - عماد عبدالعظيم (الألوكة)",
  "text_original": "ؾٌ غُ : ةٌ ثَ لاثَ ,ؽَ لذَ ر قْ غَ اهَ دَ ْـط سَ قْ لَ دلَ قَ ؾْ ل ء ؿ ِ تَ ل ْ يَ ؾٌ ِ قاطَ ؿ ػٌ قػ ِ طَ ؾٌ جُ ر : ةٌ ثََلاثَ لُ اجَ ر قْ غَ افَ طُ ز ِ ْـيَ َٓ وَ فُ لَ سَ قْ لَ ؿ ػٌ قػ ِ طَ ؾٌ جُ ر وَ , ف ِ ِ يأْ ر ِ ب افَ ْـ ِ م جَ ر خَ تْ عَ قَ وَ اذَ ِ نفَ ,تفبَ شَ تَ وَ تْ ؾَ بَ قْ أَ دَ ْـط لَ زَ كَ ؿ لا اذَ كتَ أَ ر َٕا عَ قَ وَ اذَ ِ نفَ يٌ أْ ر .)3(ادً شر ْ م ُ عُ قطيُ َٓ وَ ادً شْ ر ُ ر ُ ؿتَ ل ْ يَ َٓ )2( ر ٌ ئابَ )1( ر ٌ ئاحَ ؾٌ جُ ر َ وَ , هر ِ م ْ أَ وَ : لَ اقَ ,؟ ر ِ قاقَ ػَ لْا ثَلاثَ لا ِ ب ؿ ِ بخْ أُ َٓ أَ : لَ ا قَ ور ٍ ؿ طَ ـِ بْ للها دبْ طَ ـْ طَ و أَ نْ ِ إوَ , ر حْ أَ نْ ِ إ ,ر , ؽَ تضَ اغَ افَ تَ دْ ف ِ شَ نْ ِ إ , ءقْ س اوَ ,اهَ اشَ فْ أَ ةً ئَ قِ س نْ ِ إوَ ,اهَ اطَ غَ ةً َـس .)4( ؽَ تْ كَ اخَ افَ ْـطَ تَ بْ غ",
  "text_simplified": "The text is unclear and contains symbols that cannot be interpreted. No useful information can be extracted from it. Please provide a clear text in Arabic.",
  "labels": [
    "غير مفهوم",
    "نص مشوش",
    "غير قابل للتحليل"
  ],
  "created_at": "2026-06-21T10:15:09Z",
  "updated_at": "2026-06-21T10:15:09Z",
  "version": "1.0.0",
  "source_meta": {
    "source_title": "Alukah_Rights_of_Children",
    "source_author": ""
  },
  "source_language": "ar",
  "translated_from": "isl-ae3d3405",
  "translation": {
    "translator_model": "mistral-large-3:675b",
    "reviewer_model": "deepseek-v4-pro",
    "needs_scholar_review": true,
    "review_verdict": "defects",
    "review_defects": [
      {
        "type": "meaning_change",
        "field": "title",
        "arabic": "نص غير قابل للتحليل",
        "english": "Text Not Suitable for Analysis",
        "why": "The Arabic says the text is not analyzable (cannot be analyzed), while the English says it is not suitable for analysis, implying a different reason (appropriateness rather than capability).",
        "severity": "low"
      }
    ],
    "approved_by": null
  }
}
