{
  "id": "isl-36917162",
  "domain": "islamic_parenting",
  "source_file": "Tarbiya_Al_Banat.pdf",
  "title": "تعويد الأطفال على الصلاة وتجنب التعلق بالهاتف",
  "language": "ar",
  "age_group": "4-6",
  "behavior_type": "تربية دينية",
  "intervention_type": "إرشادي",
  "severity": "خفيف",
  "reference_type": "كتاب_تربوي",
  "reference_info": "تربية البنات",
  "text_original": "ﺔﻳﺭﺎﺠﺘﻟﺍ ﺕﻼﶈﺍ ﺪﺣﺃ ﺯﻭﺎﲡ ﺎﻫﺮﻤﻋﻭ ﻪﻳﺪﻳ ﲔﺑ ﺎﻬﻠﻌﺟﻭ ﻱﺭﺎﺠﺘﻟﺍ ﻞﶈﺍ ﱃﺇ ﺖﻨﺒﻟﺎﺑ ﻞﺧﺩ ﻪﻟ ﲔﺤﻤﺴﺗ ﻒﻴﻛ :ﺖﻠﻗ ﻻ :ﺖﻟﺎﻗ ؟ﻙﺪﻟﺍﻭ ﺍﺬﻫ :ﺎﳍ ﺖﻠﻗ !ﺔﻌﺑﺎﺴﻟﺍ ﻦﻜﻟﻭ ﻪﺘﺟﻭﺯ ﻪﻌﻣﻭ ﻖﺋﺎﺴﻟﺍ ﻼﺳﺭﺃ ﺪﻗ ﻦﻳﺪﻟﺍﻮﻟﺍ ﻥﺃ ﲏﻇ ﰲﻭ ؟ﻚﻟﺬﺑ !ﻯﺮﺧﻷﺍ ﻦﻛﺎﻣﻷﺎﺑ ﻒﻴﻜﻓ !ﻱﺭﺎﺠﺘﻟﺍ ﻞﶈﺍ ﰲ ﻞﺼﺣ ﺍﺫﺎﻣ ﺍﻭﺮﻈﻧﺍ ﻲﺼﻌﺗﻭ ﻲﻠﺼﺗ ﻻ ﺔﻣﺩﺎﺧ ﱃﺇ ﺎﻬﺘﻨﺑﺎﺑ ﻊﻓﺪﺗ ﻥﺃ ﻦﻣ ﻡﻷﺍ ﺭﺬﺤﺘﻟﻭ ﰲ ﻉﻮﻗﻭﻭ ﺔﻳﺪﻘﻋ ﺔﺛﻮﻟ ﻰﻠﻋ ﺱﺎﻧﺃ ﺄﺸﻧ ﺪﻗﻭ ،-ﻞﺟﻭ ﺰﻋ- ﷲﺍ !ﺕﺎﻣﺩﺎﳋﺍ ﻱﺪﻳﺃ ﻦﻣ ﺎﻬﻨﺑﺮﺸﺗ ﻲﺻﺎﻌﳌﺍ ﱪﻛ ﺪﻗﻭ ﺔﻌﻣﺎﳉﺍ ﰲ ﺓﺬﺗﺎﺳﻷﺍ ﺪﺣﺃ ﻥﺃ ﺓﻭﺪﻘﻟﺍ ﺏﺎﺑ ﻦﻣ ﺮﻛﺫﺃﻭ ﻪﺘﻨﺑﺍ ﻝﺎﺼﻳﻹ ﺮﻬﻇﻭ ﺡﺎﺒﺻ ﻞﻛ ﻖﺋﺎﺴﻟﺍ ﻊﻣ ﰐﺄﻳ ﺪﻋﺎﻘﺘﻠﻟ ﻞﻴﺣﺃﻭ ﻪﻨﺳ ﺕﺎﻨﺒﻟﺍ ﺔﻴﺑﺮﺗ ﰲ ﺕﺎﶈ ﻪﺘﻈﻓﺎﳏﻭ ﻩﱪﺻ ﺕﺮﻛﺬﺗ ﺎﻤﻠﻛ ﻪﻴﻠﻋ ﻢﺣﺮﺗﺃ ﺖﻟﺯ ﻻ ﷲﺍﻭﻭ !ﺔﻴﻠﻜﻟﺍ ﱃﺇ ﺓﺰﻴﻛﺮﻟﺍﻭ ﺔﻤﻴﻈﻌﻟﺍ ﺔﻀﻳﺮﻔﻟﺍ ﻲﻬﻓ ،ﺓﻼﺼﻟﺍ ،ﺓﻼﺼﻟﺍ :ﺮﺸﻋ ﱐﺎﺜﻟﺍ ﺮﻌﺸﺘﻟﻭ ،ﺎﻬﻴﻠﻋ ﺎﺻﺮﺣﺎﻓ ،ﲔﺗﺩﺎﻬﺸﻟﺍ ﺪﻌﺑ ﻡﻼﺳﻹﺍ ﺾﺋﺍﺮﻓ ﻦﻣ ﺔﻴﻧﺎﺜﻟﺍ ﷲﺍ ﺎﻫﺮﺴﻳ ﻦﻣ ﻰﻠﻋ ﺓﲑﺴﻳ ﻲﻫﻭ .ﺎﻫﺭﺪﻗ ﻢﻈﻋﻭ ﺎﻬﺘﻴﳘﺄﺑ ﺎﻤﻜﺘﻨﺑﺍ ﻪﻴﻠﻋ- ﻝﺎﻗ ﺪﻘﻓ ،ﻝﺎﻔﻃﻷﺍ ﺔﻴﺑﺮﺗ ﰲ ﻱﻮﺒﻨﻟﺍ ﺏﺩﻷﺍ ﺎﻣﺰﺘﻟﺍﻭ .ﻪﻴﻠﻋ ﻢﻛﺀﺎﻨﺑﺃ ﺍﻭﺮﻣ» :ﺪﲪﺃ ﻡﺎﻣﻹﺍ ﻚﻟﺫ ﻯﻭﺭ ﺎﻤﻛ -ﻡﻼﺴﻟﺍﻭ ﺓﻼﺼﻟﺍ ﺚﻳﺪﳊﺍ ﺍﺬﻫ ﻖﺒﻃ ﻦﻣﻭ .«ﺮﺸﻌﻟ ﺎﻬﻴﻠﻋ ﻢﻫﻮﺑﺮﺿﺍﻭ ،ﻊﺒﺴﻟ ﺓﻼﺼﻟﺎﺑ ﻡﻷﺍﻭ ﻦﻄﻔﻟﺍ ﺏﻷﺍﻭ ؛ﺓﻼﺼﻟﺍ ﺮﻣﺃ ﰲ ﺎﺒﻌﺗ ﻻﻭ ﺔﻘﺸﻣ ﻯﺮﻳ ﻻ ﻪﻧﺈﻓ ﹰﻼﺜﻣ ﻊﻀﺘﻓ ﱃﻭﻷﺍ ﻞﺣﺍﺮﳌﺍ ﰲ ﻊﻴﺠﺸﺘﻟﺍﻭ ﺓﺄﻓﺎﻜﳌﺍ ﻦﻋ ﺚﺤﺒﺗ ﺔﻨﻄﻔﻟﺍ ﷲﺍ ﻥﺃﻭ ﺓﻼﺼﻠﻟ ﺔﻨﺑﻻﺍ ﻮﻋﺪﺗﻭ ﺓﻼﺼﻟﺍ ﺓﺩﺎﺠﺳ ﰲ ﹰﻻﺎﻳﺭ ﻭﺃ ﻯﻮﻠﺣ ﺎﳍ ﺓﺩﺎﺠﺳ ﺀﺍﺮﺷ ﻚﻟﺫ ﻦﻣﻭ ،ﻚﻟﺬﺑ ﺓﲑﻐﺼﻟﺍ ﺮﺴﺘﻓ ،ﺎﻬﻗﺯﺮﻳ ﻑﻮﺳ ﺔﻨﺑﻻﺍ ﱃﺇ ﻞﻛﻮﻳ ﻥﺃ ﺪﻳﻮﻌﺘﻟﺍ ﻞﺋﺎﺳﻭ ﻦﻣﻭ ،ﺎ ﺔﻳﺎﻨﻌﻟﺍ ﻰﻠﻋ ﺎﻬﺜﺣﻭ ﻢﻛ ؟ﻥﺫﺆﳌﺍ ﻥﺫﺃ ﻞﻫ ﺔﻨﺑﻻﺍ ﺎﻤﺋﺍﺩ ﻝﺄﺴﺗ ﻡﻷﺎﻓ ﺓﻼﺼﻟﺍ ﺕﺎﻗﻭﺃ ﺓﺎﻋﺍﺮﻣ .ﺓﻼﺼﻟﺎﺑ ﻖﻠﻌﻣ ﺔﻨﺑﻻﺍ ﺐﻠﻗ ﻥﻮﻜﻳ ﱴﺣ ؟ﻥﺍﺫﻷﺍ ﻰﻠﻋ ﻲﻘﺑ ﻢﻴﺘﻳ ﻭﺃ ﻙﻮﻠﳑ ﲑﻐﺻ ﻩﺪﻨﻋ ﻥﺎﻛ ﻦﻣﻭ» :ﷲﺍ ﻪﲪﺭ ﺔﻴﻤﻴﺗ ﻦﺑﺍ ﻝﺎﻗ ،ﲑﻐﺼﻟﺍ",
  "text_simplified": "تتحدث القصة عن أم دخلت بمتجر تجاري مع ابنتها الصغيرة، ووضعت هاتفها بين يدي الطفلة لتشتت انتباهها أثناء التسوق. تحذر الأم من دفع الأمهات لبناتهن نحو الخادمات أو تركهن عرضة للمؤثرات السلبية، وتؤكد على أهمية الصلاة كأساس لتربية الأطفال. تقدم نصائح عملية لتعويد الأطفال على الصلاة منذ الصغر، مثل المكافآت والتشجيع وشراء سجادة صلاة خاصة للطفلة.",
  "labels": [
    "تربية الأطفال",
    "الصلاة",
    "التعلق بالهاتف",
    "المكافآت",
    "القدوة الحسنة"
  ],
  "created_at": "2026-06-20T11:36:50Z",
  "updated_at": "2026-06-20T11:36:50Z",
  "version": "1.0.0",
  "source_meta": {
    "source_title": "Tarbiya_Al_Banat",
    "source_author": ""
  }
}