{
  "id": "dev-97d2f1d2__en",
  "domain": "development",
  "source_file": "Positive_Parenting_3_5.pdf",
  "title": "Positive Tarbiyah Tips for Healthy Growth in the Preschool Years",
  "language": "en",
  "age_group": "4-6",
  "behavior_type": "تنمية صحية",
  "intervention_type": "إرشادي",
  "severity": "خفيف",
  "reference_type": "كتاب_تربوي",
  "reference_info": "UNICEF",
  "text_original": "Positive Parenting Tips for H ealthy Child Development Preschoolers (3-5 years of age) Developmental Milestones Skills such as naming colors, showing affection, and hopping on one foot are called developmental milestones. Developmental milestones are things most children can do by a certain age. Children reach milestones in how they play, learn, speak, behave, and move (like crawling, walking, or jumping). As children grow into early childhood, their world will begin to open up. They will become more independent and begin to focus more on adults and children outside of the family. They will want to explore and ask about the things around them even more. Their interactions with family and those around them will help to shape their personality and their own ways of thinking and moving. During this stage, children should be able to ride a tricycle, use safety scissors, notice a difference between girls and boys, help to dress and undress themselves, play with other children, recall part of a story, and sing a song. For more details on developmental milestones, warning signs of possible developmental delays, and information on how to help your child’s development, visit the \"Learn the Signs. Act Early.\" campaign website. http://www.cdc.gov/ncbddd/actearly/index.html Positive Parenting Tips Following are some things you, as a parent, can do to help your preschooler during this time:  Continue to read to your child. Nurture her love for books by taking her to the library or bookstore.  Let your child help with simple chores.  Encourage your child",
  "text_simplified": "Read to your child regularly and encourage him to take part in simple household tasks that suit his age; this supports his healthy growth, language, and self-confidence. In the preschool stage (3–5 years), developmental skills appear such as naming colours, showing affection, and hopping on one foot—follow them and celebrate them with your child.",
  "labels": [
    "تنمية طفولة",
    "القراءة",
    "الأنشطة المنزلية"
  ],
  "created_at": "2026-06-07T07:55:49Z",
  "updated_at": "2026-06-10T18:30:00Z",
  "version": "1.0.0",
  "source_meta": {
    "source_title": "Positive_Parenting_3_5",
    "source_author": ""
  },
  "source_language": "ar",
  "translated_from": "dev-97d2f1d2",
  "translation": {
    "translator_model": "mistral-large-3:675b",
    "reviewer_model": "deepseek-v4-pro+glm-5.2",
    "needs_scholar_review": true,
    "review_verdict": "clean",
    "review_defects": [],
    "approved_by": "auto-review:deepseek-v4-pro+glm-5.2:2026-10-04",
    "auto_review": {
      "reviewers": [
        "deepseek-v4-pro",
        "glm-5.2"
      ],
      "fixer": null,
      "rounds": 1,
      "prompt_version": "dfa8a5f39718",
      "content_sha256": "e752cccfd1515385ca36279f2252bff641f492851046ece41ff137668bcd0bcb",
      "reviewed_at": "2026-10-04T11:18:18+00:00",
      "residual_low": [],
      "adjudicated": [],
      "tool": "ops/tools/review_en_parity.py",
      "meaning": "deterministic guards passed and two different-family model reviewers found no medium/high defect in this exact text; not a scholar's ijazah"
    },
    "revalidated_at": "2026-10-04T11:18:18+00:00"
  }
}
