{
  "id": "isl-85e3c490",
  "domain": "islamic_parenting",
  "source_file": "Kayfa_Turabbi_Waladak.pdf",
  "title": "أساسيات تربية الطفل باحترام وتوجيه",
  "language": "ar",
  "age_group": "unspecified",
  "behavior_type": "تربية إيجابية",
  "intervention_type": "إرشادي",
  "severity": "خفيف",
  "reference_type": "كتاب_تربوي",
  "reference_info": "كيف تربي ولدك",
  "text_original": "دمتعت ةيلاع ةهمّ اذ حَ بصيل لفطلا ةيبرت نإ كلذ نلأ هتناهإو هيرقّتح مدعو هتراشتساو هيأر مارتحاب كلذو ،لفطلا ةدارإ ةيوقّت * ةفلامخو ىولها رهقو برصلا ىلع هديوعتبو ،ةناهلماو ةلذلا دوعيو هسفن رقّتيح لفطلا لعيج .ةّملها ولعو ةزعلاب رعشت كلذب سفنلا نلأ سفنلا في كلذ نوكي نأ نم رذلحا بيجو ،لمعلا ناسحإو لامكلا بلط ىلع هديوعت * لىإ لفطلا عفدي اذهو ،سانلا رثكأ لاح اذه نلأ بكرلماو نكسلماو ماعطلاو سابللا قللخا في لامكلا بلط ىلع هديوعت دوصقّلما انمإو ،لئازلا عاتلما لجلأ يصاعلما باكترا هيلع ىدتعا ناو ،لذبلا دوع لام وأ ماعط هعم ناك اذإف ،لامعلأا نسامح بلطو نيدلاو .حماستلاو وفعلا ىلع دوع دحأ لىإ سانلا دوقّي ًاينابر الماع حبصيل ملعلا بلط ىلع هثحك ةيلاعلا اياضقّلاب هقّيلعت * ،يرلخا هوجو في هقافنلإ لالما بسكو ،للها ليبس في دهاجيل ةعاجشلا ىلع هبيردتو ،ةنلجا برشلاو لكلأاك رفاكلاو ملسلما اهيف ىواستي تيلا ةيضرلأا تاعلطتلاب هقّيلعت نم رذلحاو تاوهشلا لىإ ًادلِخمُ هلعيجو ناسنلإا تاقاط لطعي بولسلأا اذهف ،ايندلا تاذلمو نودلاب ىضرلاو ،راغصَ لاو في ةيلاعلا ةملها يوذ َيرسو ،يزاغلما هميلعت قيرط نع ةملها ةيلاعلا تاودقّلاب ُهُطبر * مهئاسمأب ىّمسيو ىَنكيف ،لياعلا قلُُلخا يوذو \" اهلَيبس في ةيحضتلاو ،ةديقّعلاب مازتللاا .مبه يدتقّيل متهيرسب ثديحو ،مهانكو .33 -334 ص ،ثراحاب ناندع دلولا ةيبرت في ملسلما بلأا ةيلوئسمو ،3 ص :يزارلا ،نياحورلا بطلا :رظنا ) ( .34 -2 ص ،ميحسلا دممح ،اندلاوأ ةيبرت في انئاطخأ نم :رظنا )2( ةيعادبلإا بهاولما ةيمنتو ميلعتلا فدلها اذه ققيح نأ بيرلما نكتم تيلا بابسلأا اميف اهءاصقتسا لواحنس تيلا بابسلأا لذبب فدلها اذه ققيح نأ بيرملل نكيم مّلعيو ديحوتلا ةداهش لفطلا نقّّلي ثيح",
  "text_simplified": "تربية الطفل تتطلب احترام رأيه واستشارته، وليس قمع إرادته أو إذلاله. الطفل الذي يُحترم يشعر بالعزة ويحب العمل والإتقان. يجب تجنب التعلق المفرط بالدنيا والشهوات، بل توجيهه نحو العلم والجهاد والكرم. الهدف هو تنمية قدراته الإبداعية وتعليمه التوحيد والأخلاق العالية.",
  "labels": [
    "احترام الطفل",
    "تربية إيجابية",
    "تنمية القدرات",
    "الأخلاق",
    "التوجيه الديني"
  ],
  "created_at": "2026-06-20T14:34:48Z",
  "updated_at": "2026-06-20T14:34:48Z",
  "version": "1.0.0",
  "source_meta": {
    "source_title": "Kayfa_Turabbi_Waladak",
    "source_author": ""
  }
}