{
  "id": "cyb-9802937c__en",
  "domain": "cyber",
  "source_file": "Screen_Time_2025.pdf",
  "title": "Increase in Children’s Time Spent on Electronic Games Since 2011",
  "language": "en",
  "age_group": "prenatal-1",
  "behavior_type": "إدمان ألعاب",
  "intervention_type": "إرشادي",
  "severity": "متوسط",
  "reference_type": "كتاب_تربوي",
  "reference_info": "Common Sense Media",
  "text_original": "Eight Census survey in early 2020, moving 2-year-olds 4-year-olds 8-year-olds from 23 minutes of total time per day spent by children playing Console games :02a :02a :16b video games across all devices (consoles, handhelds, comput- Handheld games :00a :03a :08b ers, and smartphones or tablets) to 38 minutes in 2024. This Computer games :00a :02 :06b represents a 65% increase in average time spent gaming. TABLE A. Time spent gaming per day, 2011 to 2024 Total gaming :03 :21 1:04 2011 2013 2017 2020 2024 Note: Items with different superscripts differ significantly (p < .05). Console games :14 :10 :05 :07 :13 Console games :10 :06 :05* n/a :08 Handheld games :04 :04 :01* n/a :05 Computer games :08 :05 :03 :03 :04 Total gaming :25 :23 :25* :23* :38 Note: An asterisk indicates the item differs significantly (p < .05) from 2024. The years 2011 and 2013 are presented for historical reference only and were not tested against 2024 totals. While total gaming time has increased for all age groups of children since 2020, children age 4 and under show relatively modest jumps. Those under age 2 went from two to three minutes of total video game play per day. Also, 2- to 4-year- olds saw an increase in total video game play from 16 minutes to 21 minutes, and we found a large (24-minute) jump from 40 minutes to an hour and four minutes of video game play for 5- to 8-year-olds. This age difference is especially notable",
  "text_simplified": "Since 2011, the average time children spend on electronic games has risen from 23 minutes per day to 38 minutes in 2024—an increase of about 65%. This rise includes all age groups and all devices: home consoles, portable devices, and computers.",
  "labels": [
    "الألعاب الإلكترونية",
    " babies",
    "زيادة الوقت"
  ],
  "created_at": "2026-06-07T08:07:16Z",
  "updated_at": "2026-06-10T18:30:00Z",
  "version": "1.0.0",
  "source_meta": {
    "source_title": "Screen_Time_2025",
    "source_author": ""
  },
  "source_language": "ar",
  "translated_from": "cyb-9802937c",
  "translation": {
    "translator_model": "mistral-large-3:675b",
    "reviewer_model": "deepseek-v4-pro+glm-5.2",
    "needs_scholar_review": true,
    "review_verdict": "clean",
    "review_defects": [],
    "approved_by": "auto-review:deepseek-v4-pro+glm-5.2:2026-10-04",
    "auto_review": {
      "reviewers": [
        "deepseek-v4-pro",
        "glm-5.2"
      ],
      "fixer": null,
      "rounds": 1,
      "prompt_version": "dfa8a5f39718",
      "content_sha256": "4f2ef7954e3fa066097e6bd89ce1888ff602e432f3abaf06d7b507b078f42c42",
      "reviewed_at": "2026-10-04T11:18:18+00:00",
      "residual_low": [],
      "adjudicated": [],
      "tool": "ops/tools/review_en_parity.py",
      "meaning": "deterministic guards passed and two different-family model reviewers found no medium/high defect in this exact text; not a scholar's ijazah"
    },
    "revalidated_at": "2026-10-04T11:18:18+00:00"
  }
}
