{
  "id": "isl-837af34f",
  "domain": "islamic_parenting",
  "source_file": "Kayfa_Turabbi_Waladak.pdf",
  "title": "مفهوم التربية في الإسلام وأهدافها",
  "language": "ar",
  "age_group": "unspecified",
  "behavior_type": "تربية إسلامية",
  "intervention_type": "إرشادي",
  "severity": "خفيف",
  "reference_type": "كتاب_تربوي",
  "reference_info": "كيف تربي ولدك",
  "text_original": "اذبه عفني نأ للها لأسأ يرخلأا فيو :يه باوبأ ةسخم نم ثحبلا نوكتيو ةفاضإ ،بيرلما تافصو اهتناكمو اهموهفم :ملاسلإا في ةيبترلا :لولأا بابلا * .ةيبترلا في ةسردلماو دجسلما رود لىإ ،ةديقعلا خيسرت اهنمو :ملاسلإا في ةيبترلا فادهأ نم :نياثلا بابلا * ةيمنتو ميلعتلاو ،ةملها ولع ءاكذإو ،ةيصخشلا ءانبو ،ةدابعلا لىع ةئشنتلاو ةقيقعلاو دأولا مكح هيفو :ملاسلإا في لفطلا ماكحأ :ثلاثلا بابلا * ،ناتلخاو رعشلا قلحو ،ةعاضرلاو ةقفنلاو ،ثايرلماو بسنلا توبثو ،ةيمستلاو .ةدلاولاو ةناضلحاو ةيبترلاو ،ةظحلالماب ةيبترلا هيفو :اهلئاسوو ةيبترلا عاونأ :عبارلا بابلا * امأو .بيهترلاو بيغترلاب ةيبترلاو ،ةظعولمابو ،ةراشلإاب ةيبترلاو ،ةداعلاب ملعو ،ثيدلحا ملعلا تاعترمخو ،حلاصلا سيللجاو ،ةودقلا :يهف لئاسولا .ةيرطفلا عفاودلاو ةثارولا مث ،ضيرلماو يكذلاو ميتيلا ةيبرت هيفو :ةصالخا ةيبترلا :سمالخا بابلا * .تايصوتلاو جئاتنلا مهأ اهيفو ةتمالخا عفني نأ للها ةلئاس ،ةدئافلا مومع في ةبغر اًزجوم اً بولسأ ةلاسرلا تدمتعا دقو . تانسلحا نازيم في اهلعيج نأو ابه ملاسلإا في ةيبرتلا ملاسلإا في ةيبرتلا موهفم ديسلاو كلالما :ىلع قلطيو )بَرلا( مسلااو )ْببََر( لعفلا نم ٌةَقّتشم :ةغللا في ةيبرتلا .حلاصلإا وهو ثلاثلا نىعلما نم ةذوخأم ةيبرتلاو حلصلماو عاطلما نم لماكتم ملسُم ميلس ٍناسنإ ُنيوكتو ُةئشنت \" :حلاطصلاا في ةيبرتلا تافيرعت نمو ،ةيداقّتعلاا ةيحورلاو ،ةيداقّتعلااو ةيلقّعلاو ةيحصلا ةيحانلا نم ،ةفلتخلما هيحاون عيجم \" ةيعادبلإاو ةيرادلإاو ينب نم ةيبنجلأا تاتابنلا جريخو :كوشلا علقّي يذلا حلافلا لمع هبشي ةيبرتلا نىعمو \" \" هتابن نسحيل عرزلا ملاسلإا في ةيبرتلا ةناكم   { :لىاعت هلوق اهنمو ،دلولا ةيبرت لضف ىلع ثيداحلأاو تايلآا تلد في مهيلع موقّت نأو للها ةيصعم نع مهاهنتو للها ةعاطب مهرمأت\" :-للها هحمر - ةداتق لاق \" اهنع متهرجزو ،اهنع",
  "text_simplified": "هذا النص يتناول مفهوم التربية في الإسلام وأهدافها وأحكام الطفل ووسائلها. يشرح أن التربية تهدف إلى بناء شخصية متكاملة من النواحي الصحية والعقلية والدينية. كما يوضح أهمية دور المسجد والمدرسة في التربية الإسلامية.",
  "labels": [
    "تربية إسلامية",
    "أحكام الطفل",
    "وسائل التربية",
    "أهداف التربية",
    "دور المسجد"
  ],
  "created_at": "2026-06-20T14:32:03Z",
  "updated_at": "2026-06-20T14:32:03Z",
  "version": "1.0.0",
  "source_meta": {
    "source_title": "Kayfa_Turabbi_Waladak",
    "source_author": ""
  }
}